{
  "schema_version": "1.0.0",
  "record_type": "release_control_record",
  "release_control_id": "GRW-V100-RCR-001",
  "record_revision": 1,
  "created_at": "2026-07-23T00:00:00Z",
  "status": "candidate_reviewed",
  "candidate_identity": {
    "candidate_version": "1.0.0",
    "exact_commit": "0000000000000000000000000000000000000000",
    "branch_state": "local_candidate_only",
    "intended_tag": "v1.0.0",
    "intended_github_release": "This all-zero sentinel deliberately keeps the source record commit-neutral. The separately reviewed local C3 report must bind the active exact Git commit and test evidence. The record is not C4 authorization, a tag, a GitHub Release, or a runtime-installation claim."
  },
  "capability_set": {
    "capability_ledger_reference": "system/00_manifest_and_profiles/capability_truth_ledger.json",
    "candidate_outcome": "verified_candidate_or_explicitly_excluded_only",
    "verified_candidate_capability_ids": [
      "GRW-CAP-031-01",
      "GRW-CAP-031-02",
      "GRW-CAP-031-03",
      "GRW-CAP-031-04",
      "GRW-CAP-040-00",
      "GRW-CAP-040-01",
      "GRW-CAP-040-02",
      "GRW-CAP-040-04",
      "GRW-CAP-040-05",
      "GRW-CAP-040-06",
      "GRW-CAP-050-01",
      "GRW-CAP-060-01",
      "GRW-CAP-070-01",
      "GRW-CAP-080-01",
      "GRW-CAP-080-02",
      "GRW-CAP-080-03",
      "GRW-CAP-090-01",
      "GRW-CAP-090-02",
      "GRW-CAP-090-03",
      "GRW-CAP-100-01",
      "GRW-CAP-101-01",
      "GRW-CAP-110-01",
      "GRW-CAP-110-02",
      "GRW-CAP-110-03",
      "GRW-CAP-110-04",
      "GRW-CAP-110-05",
      "GRW-CAP-110-06",
      "GRW-CAP-130-01"
    ],
    "excluded_capability_ids": [
      "GRW-CAP-040-03"
    ],
    "admitted_capability_ids": []
  },
  "material_reviews": {
    "public_material_rights_review": "pass",
    "private_material_secret_review": "pass",
    "review_references": [
      "system/11_distribution_installation_and_release/PUBLIC_MATERIAL_RIGHTS_REVIEW_v1.0.0.md"
    ]
  },
  "dependency_and_source_authority": {
    "source_authority_review": "pass",
    "framework_integrated_behavior_claimed": true,
    "framework_tag": "v0.1.2",
    "framework_commit": "97fbd1f4f3cbaabb2cdbb3e106c91a6c9fd8b3a8",
    "review_reference": "system/11_distribution_installation_and_release/V1_DEPENDENCY_AND_WORKFLOW_REVIEW.md"
  },
  "release_integrity_posture": {
    "technical_immutable_release_status": "enabled",
    "deferral_or_unavailability_reason": "Prior v0.13 review recorded immutable releases as enabled. The exact repository setting, protected-main state, tag, Release, and generated archives must be rechecked before C4.",
    "reevaluation_trigger": "Before remote CI, bind a clean exact local commit. Before C4, verify the protected-main commit, CI, settings, notes, tag, Release, source archives, and public status. Any candidate change requires affected evidence to be refreshed under M48.",
    "release_assets": [
      "No additional asset is planned; generated source archives require post-release verification."
    ],
    "integrity_or_attestation_evidence_references": [
      "system/11_distribution_installation_and_release/V1_DEPENDENCY_AND_WORKFLOW_REVIEW.md",
      "system/11_distribution_installation_and_release/V1_RELEASE_EVIDENCE.md"
    ],
    "unverified_properties": [
      "Remote CI, protected-main commit, C4 authorization, immutable tag, matching GitHub Release, source archives, and installed runtime identity are not established. The active local candidate commit is established only in a separately reviewed C3 report because this source record is intentionally commit-neutral."
    ]
  },
  "supported_scope": {
    "profiles": [
      "standalone",
      "framework_integrated"
    ],
    "platforms": [
      "Local full regression is required for the exact candidate; Windows, Ubuntu, and macOS CI remain required after separately authorized remote validation."
    ],
    "approved_scope_statement": "Frozen v1 public interface, support matrix, verification traceability, and release-control evidence only. It adds no new research operation, data route, network action, helper, agent, dependency, profile, or runtime behavior."
  },
  "residual_risks": [
    "A structural interface contract cannot prove task fitness, data access, scientific truth, current external requirements, rights, human authority, compliance, publication readiness, or submission authority.",
    "Pattern scans and local review cannot establish all future contributor, institution, employment, copyright, confidentiality, or host-setting facts.",
    "This local C3 record cannot establish a remote candidate, CI, protected-main commit, C4 authorization, tag, GitHub Release, or local adoption."
  ],
  "incident_and_repair_route": "Stop affected release work, preserve exact evidence, notify the accountable human, and prepare a corrective candidate. Never rewrite an immutable tag or Release.",
  "candidate_review_acceptance_reference": "C2 and local-only C3 were accepted on 2026-07-23 for the v1.0.0 interface-freeze scope. The reviewed local tree passed 260 tests with 3 expected unconfigured-framework skips and passed scoped public-material, secret, dependency, and workflow review. This preparation record is not C3-remote evidence and remains distinct from C4.",
  "c4_release_authorization_reference": null,
  "post_release_verification_reference": null,
  "post_release_verification_plan_reference": "system/11_distribution_installation_and_release/RELEASE_CONTROL.md#post-release-route",
  "record_hierarchy_references": {
    "capability_truth_ledger": "system/00_manifest_and_profiles/capability_truth_ledger.json",
    "current_release_status": "system/11_distribution_installation_and_release/CURRENT_RELEASE_STATUS.md",
    "candidate_review_record": "local C3 snapshot: system/11_distribution_installation_and_release/V1_RELEASE_CONTROL_CANDIDATE.json",
    "c4_authorization_record": "not-yet-authorized",
    "post_release_record": "not-yet-released"
  }
}
